"Veal, shoulder, shank, lean, roasted","Lamb, Veal and Game",26.13,,Solid
"Veal, shoulder, blade, lean and fat, raw","Lamb, Veal and Game",18.72,,Solid
"Veal, shoulder, blade, lean and fat, braised","Lamb, Veal and Game",31.26,,Solid
"Veal, shoulder, blade, lean and fat, roasted","Lamb, Veal and Game",25.15,,Solid
"Veal, shoulder, blade, lean, raw","Lamb, Veal and Game",19.6,,Solid
"Veal, shoulder, blade, lean, braised","Lamb, Veal and Game",32.66,0.407,Solid
"Veal, shoulder, blade, lean, roasted","Lamb, Veal and Game",25.64,,Solid
"Veal, sirloin, lean and fat, raw","Lamb, Veal and Game",19.07,,Solid
"Veal, sirloin, lean and fat, braised","Lamb, Veal and Game",31.26,,Solid
"Veal, sirloin, lean and fat, roasted","Lamb, Veal and Game",25.14,,Solid
"Veal, sirloin, lean, raw","Lamb, Veal and Game",20.2,0.662,Solid
"Veal, sirloin, lean, braised","Lamb, Veal and Game",33.96,0.444,Solid
"Veal, sirloin, lean, roasted","Lamb, Veal and Game",26.32,,Solid
"Veal, cubed for stew (leg and shoulder), lean, raw","Lamb, Veal and Game",20.27,0.282,Solid
"Veal, cubed for stew (leg and shoulder), lean, braised","Lamb, Veal and Game",34.94,,Solid
"Veal, ground, raw","Lamb, Veal and Game",18.58,,Solid
"Veal, ground, broiled","Lamb, Veal and Game",24.38,,Solid
"Game meat, antelope, raw","Lamb, Veal and Game",22.38,0.136,Solid
"Game meat, antelope, roasted","Lamb, Veal and Game",29.45,,Solid
"Game meat, native, bear, raw","Lamb, Veal and Game",22.0,,Solid
"Game meat, native, bear, simmered","Lamb, Veal and Game",32.42,,Solid
"Game meat, native, beaver, raw","Lamb, Veal and Game",19.0,,Solid
"Game meat, native, beaver, roasted","Lamb, Veal and Game",34.85,,Solid
"Game meat, beefalo, composite cuts, raw","Lamb, Veal and Game",23.3,0.334,Solid
"Game meat, beefalo, composite cuts, roasted","Lamb, Veal and Game",30.66,,Solid
"Game meat, bison, raw","Lamb, Veal and Game",21.62,0.164,Solid
"Game meat, bison, roasted","Lamb, Veal and Game",28.44,,Solid
"Game meat, boar, wild, raw","Lamb, Veal and Game",21.51,2.641,Solid
"Game meat, boar, wild, roasted","Lamb, Veal and Game",28.3,,Solid
"Game meat, water buffalo, raw","Lamb, Veal and Game",20.39,0.156,Solid
"Game meat, water buffalo, roasted","Lamb, Veal and Game",26.83,,Solid
"Game meat, native, caribou (reindeer), meat, raw","Lamb, Veal and Game",22.5,,Solid
"Game meat, native, caribou (reindeer), meat, cooked","Lamb, Veal and Game",32.0,,Solid
"Game meat, deer (venison), raw","Lamb, Veal and Game",22.96,0.263,Solid
"Game meat, deer (venison), roasted","Lamb, Veal and Game",30.21,,Solid
"Game meat, elk, raw","Lamb, Veal and Game",22.95,0.187,Solid
"Game meat, elk, roasted","Lamb, Veal and Game",30.19,,Solid
"Game meat, goat, raw","Lamb, Veal and Game",20.6,0.179,Solid
"Game meat, goat, roasted","Lamb, Veal and Game",27.1,,Solid
"Game meat, horse, raw","Lamb, Veal and Game",21.39,0.23,Solid
"Game meat, horse, roasted","Lamb, Veal and Game",28.14,,Solid
"Game meat, native, moose, raw","Lamb, Veal and Game",22.0,,Solid
"Game meat, native, moose, roasted","Lamb, Veal and Game",35.0,,Solid
"Game meat, native, muskrat, raw","Lamb, Veal and Game",25.0,,Solid
"Game meat, muskrat, roasted","Lamb, Veal and Game",30.09,,Solid
"Game meat, opossum, roasted","Lamb, Veal and Game",30.2,,Solid
"Game meat, rabbit, domesticated, composite cuts, raw","Lamb, Veal and Game",20.05,0.26,Solid
"Game meat, rabbit, domestic, composite cuts, roasted","Lamb, Veal and Game",29.06,,Solid
"Game meat, rabbit, domestic, composite cuts, stewed","Lamb, Veal and Game",30.38,,Solid
"Game meat, native, rabbit, wild, raw","Lamb, Veal and Game",21.5,,Solid
"Game meat, native, rabbit, wild, cooked","Lamb, Veal and Game",29.0,,Solid
"Game meat, raccoon, roasted","Lamb, Veal and Game",29.2,,Solid
"Game meat, squirrel, raw","Lamb, Veal and Game",21.23,0.194,Solid
"Game meat, squirrel, roasted","Lamb, Veal and Game",30.77,,Solid
"Lamb, brain, raw","Lamb, Veal and Game",10.4,0.512,Solid
"Lamb, brain, braised","Lamb, Veal and Game",12.55,0.192,Solid
"Lamb, brain, pan-fried","Lamb, Veal and Game",16.97,,Solid
"Veal, brain, raw","Lamb, Veal and Game",10.32,0.046,Solid
"Veal, brain, braised","Lamb, Veal and Game",11.48,0.609,Solid
"Veal, brain, pan-fried","Lamb, Veal and Game",14.48,,Solid
"Lamb, heart, raw","Lamb, Veal and Game",16.47,0.381,Solid
"Lamb, heart, braised","Lamb, Veal and Game",24.97,,Solid
"Veal, heart, raw","Lamb, Veal and Game",17.18,0.314,Solid
"Veal, heart, braised","Lamb, Veal and Game",29.12,,Solid
"Lamb, kidney, raw","Lamb, Veal and Game",15.74,0.234,Solid
"Lamb, kidney, braised","Lamb, Veal and Game",23.65,0.805,Solid
"Veal, kidney, raw","Lamb, Veal and Game",15.76,0.445,Solid
"Veal, kidney, braised","Lamb, Veal and Game",26.32,0.328,Solid
"Lamb, liver, raw","Lamb, Veal and Game",20.38,,Solid
"Lamb, liver, braised","Lamb, Veal and Game",30.57,,Solid
"Lamb, liver, pan-fried","Lamb, Veal and Game",25.53,1.312,Solid
"Veal, liver, raw","Lamb, Veal and Game",19.93,,Solid
"Veal, liver, braised","Lamb, Veal and Game",28.42,,Solid
"Veal, liver, pan-fried","Lamb, Veal and Game",27.37,,Solid
"Lamb, lungs, raw","Lamb, Veal and Game",16.7,0.231,Solid
"Lamb, lungs, braised","Lamb, Veal and Game",19.88,,Solid
"Veal, lungs, raw","Lamb, Veal and Game",16.3,0.404,Solid
"Veal, lungs, braised","Lamb, Veal and Game",18.74,,Solid
"Lamb, mechanically separated, raw","Lamb, Veal and Game",14.97,,Solid
"Lamb, pancreas, raw","Lamb, Veal and Game",14.84,0.213,Solid
"Lamb, pancreas, braised","Lamb, Veal and Game",22.83,,Solid
"Veal, pancreas, raw","Lamb, Veal and Game",15.0,0.231,Solid
"Veal, pancreas, braised","Lamb, Veal and Game",29.1,0.23,Solid
"Lamb, spleen, raw","Lamb, Veal and Game",17.2,0.404,Solid
"Lamb, spleen, braised","Lamb, Veal and Game",26.46,,Solid
"Veal, spleen, raw","Lamb, Veal and Game",18.3,0.173,Solid
"Veal, spleen, braised","Lamb, Veal and Game",24.08,,Solid
"Veal, thymus, raw","Lamb, Veal and Game",17.21,,Solid
"Veal, thymus, braised","Lamb, Veal and Game",22.67,,Solid
"Lamb, tongue, raw","Lamb, Veal and Game",15.7,0.638,Solid
"Lamb, tongue, braised","Lamb, Veal and Game",21.57,0.643,Solid
"Veal, tongue, raw","Lamb, Veal and Game",17.18,0.787,Solid
"Veal, tongue, braised","Lamb, Veal and Game",25.85,0.402,Solid
"Lamb, Canadian, ground, raw","Lamb, Veal and Game",17.06,0.78,Solid
"Lamb, Canadian, ground, cooked","Lamb, Veal and Game",27.11,,Solid
"Game meat, native, caribou (reindeer), bone marrow, raw","Lamb, Veal and Game",6.9,0.0,Solid
"Game meat, frog legs, raw","Lamb, Veal and Game",16.4,0.0,Solid
"Game meat, frog legs, breaded and fried","Lamb, Veal and Game",17.4,0.0,Solid
"Game meat, seal, harp, raw","Lamb, Veal and Game",23.8,0.0,Solid
"Game meat, native, walrus, meat, raw","Lamb, Veal and Game",23.5,,Solid
"Game meat, whale, raw","Lamb, Veal and Game",26.5,,Solid
"Veal, grain-fed, cutlets (inside top round), raw","Lamb, Veal and Game",22.33,0.204,Solid
"Veal, grain-fed, cutlets (inside top round), braised","Lamb, Veal and Game",38.28,0.19,Solid
"Veal, grain-fed, cutlets (inside rop round), pan-fried","Lamb, Veal and Game",36.09,0.857,Solid
"Veal, grain-fed, loin chop, lean and fat, raw","Lamb, Veal and Game",20.67,0.26,Solid
"Veal, grain-fed, loin chop, lean and fat, braised","Lamb, Veal and Game",33.6,0.26,Solid
"Veal, grain-fed, loin chop, lean, raw","Lamb, Veal and Game",21.49,0.2,Solid
"Veal, grain-fed, loin chop, lean, braised","Lamb, Veal and Game",33.23,0.34,Solid
"Veal, grain-fed, rib chop, lean and fat, raw","Lamb, Veal and Game",19.15,0.323,Solid
"Veal, grain-fed, rib chop, lean and fat, broiled","Lamb, Veal and Game",24.51,1.927,Solid
"Veal, grain-fed, rib chop, lean, raw","Lamb, Veal and Game",22.7,0.2,Solid
"Veal, grain-fed, rib chop, lean, broiled","Lamb, Veal and Game",30.41,0.587,Solid
"Veal, grain-fed, shoulder, whole, lean and fat, raw","Lamb, Veal and Game",21.47,0.288,Solid
"Veal, grain-fed, shoulder, whole, lean and fat, roasted","Lamb, Veal and Game",30.28,0.331,Solid
"Veal, grain-fed, shoulder, whole, lean, raw","Lamb, Veal and Game",22.13,0.244,Solid
"Veal, grain-fed, shoulder, whole, lean, roasted","Lamb, Veal and Game",31.3,0.296,Solid
"Veal, grain-fed, shoulder, shank, lean and fat, raw","Lamb, Veal and Game",20.35,0.88,Solid
"Veal, grain-fed, shoulder, shank, lean and fat, braised","Lamb, Veal and Game",32.06,0.92,Solid
"Veal, grain-fed, shoulder, shank, lean, raw","Lamb, Veal and Game",19.2,0.48,Solid
"Veal, grain-fed, shoulder, shank, lean, braised","Lamb, Veal and Game",32.77,1.17,Solid
"Bagel, plain (with onion, poppy seed and/or sesame seed)",Baked Products,10.56,0.135,Solid
"Bagel, plain (with onion, poppy seed and/or sesame seed), toasted",Baked Products,11.14,,Solid
"Bagel, egg",Baked Products,10.6,,Solid
"Bagel, cinnamon-raisin",Baked Products,9.8,,Solid
"Bagel, cinnamon-raisin, toasted",Baked Products,10.6,,Solid
"Bagel, oat bran",Baked Products,10.7,,Solid
"Biscuit, plain/buttermilk, dry mix, unprepared",Baked Products,8.0,0.132,Solid
"Biscuit, plain/buttermilk, refrigerated dough, lower fat",Baked Products,6.7,0.064,Solid
"Biscuit, plain/buttermilk, refrigerated dough, lower fat, baked",Baked Products,7.8,,Solid
"Biscuit, plain/buttermilk, refrigerated dough, higher fat",Baked Products,6.66,0.061,Solid
"Biscuit, plain/buttermilk, refrigerated dough, higher fat, baked",Baked Products,6.79,0.066,Solid
"Biscuit, plain/buttermilk, homemade",Baked Products,7.0,,Solid
"Biscuit, multigrain, refrigerated dough",Baked Products,6.1,,Solid
"Bread, banana, homemade, made with margarine",Baked Products,4.3,,Solid
"Bread, Boston brown, canned",Baked Products,5.2,0.932,Solid
"Bread, cornbread (also corn muffin mix), dry mix, unprepared",Baked Products,7.0,0.077,Solid
"Bread, cornbread, homemade, made with 2% milk",Baked Products,6.7,,Solid
"Bread, egg (Challah)",Baked Products,9.5,,Solid
"Bread, egg, (challah), toasted",Baked Products,10.5,,Solid
"Bread, French or Vienna, (also sourdough), toasted",Baked Products,13.0,,Solid
"Bread, Italian",Baked Products,8.82,0.161,Solid
"Bread, multigrain, commercial",Baked Products,11.01,0.241,Solid
"Bread, multigrain, toasted",Baked Products,12.13,,Solid
"Bread, pita, white",Baked Products,9.1,0.098,Solid
"Bread, pita, whole-wheat",Baked Products,9.8,,Solid
"Bread, protein (includes gluten)",Baked Products,12.1,0.141,Solid
"Bread, pumpernickel",Baked Products,7.33,,Solid
"Bread, pumpernickel, toasted",Baked Products,8.11,,Solid
"Bread, white with raisins, commercial",Baked Products,7.52,0.151,Solid
"Bread, white with raisins, commercial, toasted",Baked Products,8.15,,Solid
"Bread, rice bran, gluten free",Baked Products,8.9,0.468,Solid
"Bread, rye, toasted",Baked Products,10.01,,Solid
"Bread, wheat germ",Baked Products,9.6,0.099,Solid
"Bread, white, commercial, toasted",Baked Products,10.08,,Solid
"Bread, white, homemade with nonfat dry milk",Baked Products,7.7,,Solid
"Bread, white, homemade with 2% milk",Baked Products,7.9,,Solid
"Bread, whole wheat, homemade (2/3 whole wheat flour)",Baked Products,8.4,,Solid
"Bread, whole wheat, homemade (2/3 whole wheat flour), toasted",Baked Products,9.2,,Solid
"Bread stick, plain",Baked Products,12.0,0.351,Solid
"Bread stuffing, dry mix, prepared",Baked Products,3.2,,Solid
"Bread stuffing, cornbread, dry mix, unprepared",Baked Products,10.0,0.062,Solid
"Bread stuffing, cornbread, dry mix, prepared",Baked Products,2.9,,Solid
"Cake, angel food, commercial",Baked Products,5.9,0.071,Solid
"Cake mix, angel food, dry, unprepared",Baked Products,6.4,,Solid
"Cake, angel food, dry mix, prepared",Baked Products,6.1,,Solid
"Cake, Boston cream pie, commercial",Baked Products,2.4,0.278,Solid
"Cake mix, carrot, pudding-type, dry, unprepared",Baked Products,5.1,,Solid
"Cake, cherry fudge with chocolate icing (frosting)",Baked Products,2.4,,Solid
"Cake, chocolate, commercial, with chocolate icing (frosting), in-store bakery",Baked Products,3.48,0.168,Solid
"Cake mix, chocolate, pudding-type, dry, unprepared",Baked Products,4.6,0.058,Solid
"Cake mix, chocolate (devil's food, fudge), regular, dry, unprepared",Baked Products,5.9,0.402,Solid
"Cake, chocolate, homemade, without icing (frosting)",Baked Products,5.3,,Solid
"Cake, white, homemade, with coconut icing (frosting)",Baked Products,4.4,,Solid
"Coffee cake, cheese",Baked Products,7.0,0.06,Solid
"Coffee cake, cinnamon with crumb topping, commercial",Baked Products,6.8,0.166,Solid
"Coffee cake, fruit",Baked Products,5.2,0.204,Solid
"Coffee cake mix, cinnamon with crumb topping, dry, unprepared",Baked Products,4.8,0.087,Solid
"Coffee cake, cinnamon with crumb topping, dry mix, prepared",Baked Products,5.5,,Solid
"Cake, fruitcake, commercial",Baked Products,2.9,,Solid
"Cake mix, german chocolate, pudding-type mix, dry, unprepared",Baked Products,4.17,,Solid
"Cake mix, gingerbread, dry, unprepared",Baked Products,4.4,,Solid
"Cake, gingerbread, homemade",Baked Products,3.9,,Solid
"Cake mix, marble, pudding-type, dry, unprepared",Baked Products,3.4,0.09,Solid
"Cake, pineapple upside-down, homemade",Baked Products,3.5,,Solid
"Cake, pound, commercial, made with butter (includes fresh and frozen)",Baked Products,5.0,0.099,Solid
"Cake, pound, commercial, made with other than butter",Baked Products,5.2,0.092,Solid
"Cake, snack cake, cream-filled, chocolate with icing (frosting)",Baked Products,3.63,,Solid
"Cake, snack cake, cream-filled, sponge",Baked Products,3.47,,Solid
"Cake, sponge, commercial",Baked Products,5.4,,Solid
"Cake, sponge, homemade",Baked Products,7.3,,Solid
"Cake, white, pudding-type, dry mix, unprepared",Baked Products,3.9,0.115,Solid
"Cake, white, regular, dry mix, unprepared",Baked Products,4.12,,Solid
"Cake, white, homemade, without icing (frosting)",Baked Products,5.4,,Solid
"Cake, yellow, commercial, with chocolate icing (frosting), in-store bakery",Baked Products,3.16,0.115,Solid
"Cake, yellow, commercial, with vanilla (white) icing (frosting)",Baked Products,2.99,,Solid
"Cake, yellow (plus streusel), pudding-type, dry mix, unprepared",Baked Products,4.0,0.103,Solid
"Cake, yellow, regular, dry mix, unprepared",Baked Products,3.7,,Solid
"Cake, yellow, homemade, without icing (frosting)",Baked Products,5.3,,Solid
"Cheesecake, commercial",Baked Products,5.5,0.553,Solid
"Cheesecake, prepared from mix, no bake type",Baked Products,5.5,0.163,Solid
"Cookie, animal crackers (arrowroot, social tea)",Baked Products,6.9,0.155,Solid
"Cookie, brownie, commercial",Baked Products,4.8,0.173,Solid
"Cookie, brownie, regular, dry mix, unprepared",Baked Products,4.0,0.047,Solid
"Cookie, brownie, homemade",Baked Products,6.2,,Solid
"Cookie, butter, commercial",Baked Products,6.1,0.411,Solid
"Cookie, fudge, cake-type",Baked Products,5.0,0.064,Solid
"Cookie, chocolate wafer",Baked Products,6.6,0.141,Solid
"Cookie, chocolate chip, commercial, regular, lower fat",Baked Products,5.97,,Solid
"Cookie, chocolate chip, commercial, regular, higher fat",Baked Products,5.1,0.066,Solid
"Cookie, chocolate chip, soft type, commercial",Baked Products,3.63,0.062,Solid
"Cookie, chocolate chip, dry mix, unprepared",Baked Products,4.6,,Solid
"Cookie, chocolate chip, refrigerated dough",Baked Products,3.98,,Solid
"Cookie, chocolate chip, homemade, made with margarine",Baked Products,5.7,,Solid
"Cookie, chocolate sandwich, cream filling, regular",Baked Products,5.21,0.034,Solid
"Cookie, chocolate sandwich, cream filling, chocolate-coated",Baked Products,3.6,0.177,Solid
"Cookie, chocolate sandwich, extra cream filling",Baked Products,4.33,,Solid
"Cookie, coconut macaroon",Baked Products,3.02,,Solid
"Cookie, fig bar",Baked Products,3.7,0.075,Solid
"Cookie, fortune",Baked Products,4.2,,Solid
"Cookie, ginger snap",Baked Products,5.6,0.117,Solid
"Cookie, graham cracker, plain or honey (includes cinnamon)",Baked Products,6.69,0.042,Solid
"Cookie, graham cracker, chocolate-coated",Baked Products,4.0,,Solid
"Cookie, ladyfinger (with lemon juice and rind)",Baked Products,10.6,,Solid
"Cookie, marshmallow (includes pies), chocolate-coated",Baked Products,4.0,0.123,Solid
"Cookie, molasses",Baked Products,5.6,0.183,Solid
"Cookie, oatmeal (with or without raisins), commercial",Baked Products,6.2,0.104,Solid
"Cookie, oatmeal (with or without raisins), commercial, soft-type",Baked Products,6.1,0.126,Solid
"Cookie, oatmeal (with or without raisins), dry mix, unprepared",Baked Products,6.5,0.108,Solid
"Cookie, oatmeal (with or without raisins), refrigerated dough",Baked Products,5.4,0.108,Solid
"Cookie, oatmeal, homemade, with raisins",Baked Products,6.5,,Solid
"Cookie, peanut butter, commercial",Baked Products,8.92,0.782,Solid
"Cookie, peanut butter, commercial, soft-type",Baked Products,5.3,,Solid
"Cookie, peanut butter, refrigerated dough",Baked Products,8.2,0.171,Solid
"Cookie, peanut butter, homemade, with margarine",Baked Products,9.0,,Solid
"Cookie, peanut butter sandwich",Baked Products,8.8,0.171,Solid
"Cookie, raisin, soft-type",Baked Products,4.1,0.473,Solid
"Cookie, shortbread, plain, commercial",Baked Products,5.37,0.021,Solid
"Cookie, shortbread, pecan, commercial",Baked Products,4.9,0.127,Solid
"Cookie, sugar, commercial",Baked Products,5.35,0.242,Solid
"Cookie, sugar, refrigerated dough",Baked Products,4.0,,Solid
"Cookie, sugar, refrigerated dough, baked",Baked Products,4.7,,Solid
"Cookie, sugar, homemade, made with margarine",Baked Products,5.9,,Solid
"Cookie, sugar wafer sandwich with cream filling",Baked Products,3.84,0.149,Solid
"Cookie, vanilla sandwich with cream filling",Baked Products,4.5,0.093,Solid
"Puff pastry, frozen, ready-to-bake, baked",Baked Products,7.4,,Solid
"Cookie, vanilla wafer, 12 to 17% fat",Baked Products,5.0,0.055,Solid
"Cookie, vanilla wafer, 18 to 21% fat",Baked Products,4.3,0.045,Solid
"Cracker, cheese",Baked Products,10.93,0.111,Solid
"Cracker, cheese, sandwich-type, with peanut butter filling",Baked Products,12.41,0.14,Solid
"Cracker, crispbread, rye",Baked Products,7.9,0.129,Solid
"Cracker, matzo, plain",Baked Products,10.0,0.176,Solid
"Cracker, matzo, egg",Baked Products,12.3,,Solid
"Cracker, matzo, whole-wheat",Baked Products,13.1,0.6,Solid
"Cracker, melba toast, rye (includes pumpernickel)",Baked Products,11.6,0.298,Solid
"Cracker, melba toast, wheat",Baked Products,12.9,0.382,Solid
"Cracker, milk",Baked Products,7.6,0.127,Solid
"Cracker, rusk toast",Baked Products,13.5,0.25,Solid
"Cracker, rye, sandwich-type with cheese filling",Baked Products,9.2,0.486,Solid
"Cracker, rye, wafers, plain",Baked Products,9.6,0.101,Solid
"Cracker, rye, wafers, seasoned",Baked Products,9.0,0.147,Solid
"Cracker, saltine (also oyster, soda, soup)",Baked Products,9.46,0.041,Solid
"Cracker, standard snack-type, sandwich, with cheese filling",Baked Products,9.3,0.314,Solid
"Cracker, standard snack-type, sandwich with peanut butter",Baked Products,11.47,0.185,Solid
"Cracker, wheat",Baked Products,7.3,0.08,Solid
"Cracker, wheat, sandwich, with cheese filling",Baked Products,9.8,,Solid
"Cracker, wheat, sandwich, with peanut butter filling",Baked Products,13.5,0.545,Solid
"Cracker, whole-wheat",Baked Products,10.58,0.2,Solid
Cracker meal,Baked Products,9.3,0.267,Solid
"Cream puff, homemade, shell only, includes eclair",Baked Products,9.0,,Solid
"Croissant, butter, commercial",Baked Products,8.2,0.03,Solid
"Croissant, apple, commercial",Baked Products,7.4,,Solid
"Croissant, cheese, commercial",Baked Products,9.2,,Solid
"Croutons, plain",Baked Products,11.9,0.971,Solid
"Croutons, seasoned",Baked Products,10.8,0.146,Solid
"Danish pastry, cinnamon",Baked Products,7.0,0.511,Solid
"Danish pastry, cheese",Baked Products,8.0,,Solid
"Danish pastry, fruit (apple, raisin, lemon, raspberry)",Baked Products,5.4,0.23,Solid
"Danish pastry, nut (almond, raisin nut, cinnamon nut)",Baked Products,7.1,0.186,Solid
"Doughnut (donut), cake-type, plain (includes unsugared, old-fashioned)",Baked Products,5.31,0.072,Solid
"Doughnut (donut), cake-type, plain, chocolate coated or iced",Baked Products,4.93,,Solid
"Doughnut (donut), cake-type, plain, sugared or glazed",Baked Products,5.2,0.332,Solid
"Doughnut (donut), French cruller, glazed",Baked Products,3.1,,Solid
"Doughnut (donut), yeast-leavened, with cream filling",Baked Products,6.4,,Solid
"Doughnut (donut), yeast-leavened (honey bun), glazed",Baked Products,6.14,0.181,Solid
"Doughnut (donut), yeast-leavened, with jelly filling",Baked Products,5.9,,Solid
"English muffin, plain (also sourdough)",Baked Products,8.87,,Solid
"English muffin, plain (also sourdough), toasted",Baked Products,10.32,,Solid
"English muffin, multigrain (also granola)",Baked Products,9.1,0.261,Solid
"English muffin, multigrain (also granola), toasted",Baked Products,9.9,,Solid
"English muffin, raisin-cinnamon (apple cinnamon)",Baked Products,7.91,,Solid
"English muffin, raisin-cinnamon, (apple cinnamon) toasted",Baked Products,8.87,,Solid
"English muffin, wheat",Baked Products,8.7,0.38,Solid
"English muffin, wheat, toasted",Baked Products,9.4,,Solid
"English muffin, whole wheat",Baked Products,8.8,,Solid
"English muffin, whole wheat, toasted",Baked Products,9.6,,Solid
"French toast, frozen, ready to heat",Baked Products,7.4,0.058,Solid
"French toast, homemade, with 2% milk and margarine",Baked Products,7.7,,Solid
"Hush puppy, homemade",Baked Products,7.7,,Solid
"Ice cream cone, cake or wafer-type",Baked Products,8.1,0.234,Solid
"Ice cream cone, sugar, rolled-type",Baked Products,7.9,0.212,Solid
"Muffin, plain, homemade, made with 2% milk",Baked Products,6.9,,Solid
"Muffin, blueberry, commercial",Baked Products,4.49,0.069,Solid
"Muffin, blueberry, dry mix, unprepared",Baked Products,3.48,,Solid
"Muffin, blueberry, toaster-type",Baked Products,4.6,,Solid
"Muffin, blueberry, homemade, with 2% milk",Baked Products,6.5,,Solid
"Muffin, corn, commercial",Baked Products,5.9,,Solid
"Muffin, corn, toaster type",Baked Products,5.3,,Solid
"Muffin, corn, homemade, with 2% milk",Baked Products,7.1,,Solid
"Muffin, oat bran (wheat free-product)",Baked Products,7.0,,Solid
"Muffin, wheat bran, dry mix, unprepared",Baked Products,7.1,,Solid
"Pancake, plain (includes buttermilk), frozen, ready-to-heat",Baked Products,5.23,0.057,Solid
"Pancake, plain (includes buttermilk), dry mix, complete, unprepared",Baked Products,9.77,0.06,Solid
"Pancake, plain (includes buttermilk), dry mix, incomplete, unprepared",Baked Products,10.0,0.117,Solid
"Pancake, plain, homemade",Baked Products,6.4,,Solid
"Pancake, blueberry, homemade",Baked Products,6.1,,Solid
"Pancake, buckwheat, dry mix, incomplete, unprepared",Baked Products,10.9,0.152,Solid
"Pancake, whole-wheat, dry mix, incomplete, unprepared",Baked Products,12.8,0.062,Solid
"Pie, apple, commercial, 2 crust",Baked Products,1.9,0.103,Solid
"Pie, apple, homemade, 2 crust",Baked Products,2.4,,Solid
"Pie, banana cream, prepared from mix, no-bake type",Baked Products,3.4,,Solid
"Pie, banana cream, homemade",Baked Products,4.4,,Solid
"Pie, blueberry, homemade, 2 crust",Baked Products,2.7,,Solid
"Pie, cherry, homemade, 2 crust",Baked Products,2.8,,Solid
"Pie, chocolate cream, commercial",Baked Products,4.15,,Solid
"Pie, chocolate mousse, prepared from mix, no-bake type",Baked Products,3.5,,Solid
"Pie, coconut cream, commercial",Baked Products,2.1,,Solid
"Pie, coconut cream, prepared from  mix, no-bake type",Baked Products,2.8,,Solid
"Pie, coconut custard, commercial",Baked Products,5.9,0.055,Solid
"Pie, egg custard, commercial",Baked Products,5.5,0.196,Solid
"Pie, fried, fruit (apple, blueberry, peach, strawberry)",Baked Products,3.0,0.165,Solid
"Pie, lemon meringue, commercial",Baked Products,1.5,0.207,Solid
"Pie, lemon meringue, homemade",Baked Products,3.8,,Solid
"Pie, mincemeat, homemade, 2 crust",Baked Products,2.6,,Solid
"Pie, pecan, commercial",Baked Products,4.5,,Solid
"Pie, pecan, homemade",Baked Products,4.9,,Solid
"Pie, pumpkin, homemade",Baked Products,4.5,,Solid
"Pie, vanilla cream, homemade",Baked Products,4.8,,Solid
"Pie crust, standard-type, dry mix, unprepared",Baked Products,6.9,0.152,Solid
"Pie crust, standard type, frozen, ready-to-bake",Baked Products,6.16,,Solid
"Pie crust, standard type, frozen, ready-to-bake, baked",Baked Products,6.5,,Solid
"Pie crust, standard type, homemade, baked",Baked Products,6.4,,Solid
"Puff pastry, frozen, ready-to-bake",Baked Products,7.3,,Solid
Phyllo dough,Baked Products,7.1,,Solid
"Popover, dry mix, unprepared",Baked Products,10.4,0.079,Solid
"Roll, dinner, egg",Baked Products,9.5,0.154,Solid
"Roll, dinner, oat bran",Baked Products,9.5,,Solid
"Roll, dinner, rye",Baked Products,10.3,,Solid
"Roll, dinner, wheat (60% whole wheat flour)",Baked Products,8.6,,Solid
"Roll, dinner, whole wheat",Baked Products,8.7,,Solid
"Roll, french",Baked Products,8.6,0.354,Solid
"Roll, hamburger / hot dog, plain",Baked Products,9.87,0.174,Solid
"Roll, hamburger / hot dog, multigrain",Baked Products,9.6,0.215,Solid
"Roll, hamburger / hot dog, Calorie-reduced",Baked Products,8.3,,Solid
"Roll (kaiser), hard",Baked Products,9.9,0.185,Solid
"Strudel, apple",Baked Products,3.3,,Solid
"Sweet roll, cinnamon with raisins, commercial",Baked Products,6.2,0.312,Solid
"Sweet roll, cinnamon, refrigerated dough, with icing (frosting)",Baked Products,5.0,0.138,Solid
"Taco shell, baked",Baked Products,6.41,0.057,Solid
"Toaster pastry, brown sugar and cinnamon",Baked Products,4.06,,Solid
"Toaster pastry, fruit (apple, blueberry, cherry, strawberry)",Baked Products,4.2,0.116,Solid
"Tortilla, ready-to-bake / fry, corn",Baked Products,5.7,0.128,Solid
"Waffle, plain, frozen, ready-to-heat",Baked Products,6.47,,Solid
"Waffle, plain, homemade",Baked Products,7.9,,Solid
Wonton wrapper (egg roll wrapper),Baked Products,9.8,,Solid
"Leavening agent, baking powder, double acting, sodium, aluminium sulfate",Baked Products,0.0,,Solid
"Leavening agent, baking powder, double acting, phosphate",Baked Products,0.1,,Solid
"Leavening agent, baking powder, low sodium",Baked Products,0.1,,Solid
"Leavening agent, baking soda",Baked Products,0.0,,Solid
"Leavening agent, cream of tartar",Baked Products,0.0,,Solid
"Leavening agent, yeast, baker's, compressed",Baked Products,8.4,,Solid
